{
  "$schema": "https://json-schema.org/draft/2020-12/schema",
  "type": "object",
  "additionalProperties": false,
  "required": [
    "schema_version",
    "skill",
    "language",
    "context",
    "sources",
    "content"
  ],
  "properties": {
    "schema_version": {
      "const": "1.0"
    },
    "skill": {
      "const": "tw-edu-learning-portfolio"
    },
    "language": {
      "const": "zh-CN"
    },
    "context": {
      "type": "object",
      "additionalProperties": false,
      "required": [
        "subject",
        "grade",
        "topic"
      ],
      "properties": {
        "subject": {
          "type": "string",
          "minLength": 1
        },
        "grade": {
          "type": "string",
          "minLength": 1
        },
        "topic": {
          "type": "string",
          "minLength": 1
        }
      }
    },
    "sources": {
      "type": "array",
      "items": {
        "type": "object",
        "additionalProperties": false,
        "required": [
          "title",
          "status"
        ],
        "properties": {
          "title": {
            "type": "string",
            "minLength": 1
          },
          "url": {
            "type": "string"
          },
          "status": {
            "enum": [
              "verified",
              "user_provided",
              "pending"
            ]
          }
        }
      }
    },
    "content": {
      "type": "object",
      "additionalProperties": false,
      "required": [
        "title",
        "records"
      ],
      "properties": {
        "title": {
          "type": "string",
          "minLength": 1
        },
        "records": {
          "type": "array",
          "minItems": 1,
          "items": {
            "type": "object",
            "additionalProperties": false,
            "required": [
              "date",
              "artifact",
              "evidence",
              "reflection",
              "next_step"
            ],
            "properties": {
              "date": {
                "type": "string",
                "minLength": 1
              },
              "artifact": {
                "type": "string",
                "minLength": 1
              },
              "evidence": {
                "type": "string",
                "minLength": 1
              },
              "reflection": {
                "type": "string",
                "minLength": 1
              },
              "next_step": {
                "type": "string",
                "minLength": 1
              }
            }
          }
        }
      }
    }
  }
}
